#CODE	ENGLISH	ENGLISH
EVTDESC_TOG_617	The guards fetch your son, [From.GetTitledFirstName], from his dungeon and lead him to the temple. There a noose is placed around his neck and the rope is thrown over a sturdy branch of a nearby oak. Before your men pull at the rope, your son looks at you with tearful eyes. Please don't, [Root.GetFatherMother]... please don't.	Despite having sworn you fealty, [From.GetTitledFirstName] refuses to offer gold in order to be exempted from the blot! According to [From.GetFirstName], [From.Religion.GetRandomGodName] would not forgive [From.GetHerHim] if [From.GetSheHe] contributed as much as a single copper to a heathen festival.
EVTOPTA_TOG_617	Do it, men.	This insult will not be forgotten.
EVTOPTB_TOG_617	I can't do this... not to my own boy...	The guests have arrived, and the time has come for the blot to begin! You gather outside the temple, and start by offering animals as sacrifice to the gods. While their meat is prepared for the feast that is to follow, the blood is sprinkled on statues of Odin, Thor, Freyr and the other gods, as well as on the worshippers themselves.
EVTDESC_TOG_618	Your daughter, [From.GetTitledFirstName], is pulled from her dungeon and brought to the temple by your guards. As they place the noose around her neck, she looks at you with a desperate yet piercing glare. Is this really what you have been reduced to, [Root.GetFatherMother]? To do this... against your own daughter?	Now for the human sacrifice...
EVTOPTA_TOG_618	You have left me with little choice.	The time has come for the blot held by [From.GetTitledFirstName] to begin! You gather outside the temple, and start by offering animals as sacrifice to the gods. While their meat is prepared for the feast that is to follow, the blood is sprinkled on statues of Odin, Thor, Freyr and the other gods, as well as on the worshippers themselves.
EVTOPTB_TOG_618	No, send her back... not to my girl...	Although you have been told little, the noise from outside your dungeon is enough to make it clear that your captor, [Root.Host.GetTitledFirstName] is holding a blot where [Root.Host.GetSheHe] will offer sacrifice in worship of [Root.Host.GetHerHis] gods. Guards burst inside your cell and drag you away to the gallows outside the local temple... 
EVTDESC_TOG_619	[From.GetTitledFirstName] is brought from your dungeons by the guards and placed at the gallows in front of the temple. As they place the noose around [From.GetHerHis] neck, [From.GetFirstName] cries out to you. Don't do this, [Root.GetFirstName]! We are family and of the same blood!	No! Not like this!
EVTOPTA_TOG_619	Yes, and that only proves my devotion to Odin.	[From.GetTitledFirstName] is brought up from your dungeons and escorted to the temple. A noose is placed around [From.GetHerHis] neck and the rope is thrown over a sturdy branch of a nearby oak. A small yellow pool forms at [From.GetFirstName]'s feet.
EVTOPTB_TOG_619	It is true... [From.GetSheHe] is kin.	Allfather, we offer you this sacrifice...
EVTDESC_TOG_620	Your spouse, [From.GetTitledFirstName], is dragged to the gallows in front of the temple and your guards place the noose around [From.GetHerHis] neck. In a last desperate effort to save  [From.GetHerselfHimself], [From.GetFirstName] calls out to you for mercy. I have always loved you, [Root.GetFirstName]... and I always will.	No, I have changed my mind.
EVTOPTA_TOG_620	Forgive me then, my love, but this is how it must be.	[From.GetTitledFirstName] is brought up from your dungeons and escorted to the temple. As the noose is placed around [From.GetHerHis] neck, [From.GetSheHe] steadies [From.GetHerselfHimself] and murmurs several passages that you recognize as being from the Christian holy book.
EVTOPTB_TOG_620	No, this is too much... I can't permit it.	Where is your Blessed Virgin now, [From.GetFirstName]?
EVTDESC_TOG_621	From deep within your dungeons, your guards bring out [From.GetTitledFirstName], your Skræling prisoner. As they drag [From.GetHerHim] to the front of the temple and place the noose around [From.GetHerHis] neck, the Skræling shouts something in [From.GetHerHis] own language and stares at you defiantly.	No, perhaps this is a bad idea...
EVTOPTA_TOG_621	Let us show you how a proper human sacrifice is done.	[From.GetTitledFirstName] is brought up from your dungeons and escorted to the temple. Your guards place the noose around [From.GetHerHis] neck while [From.GetSheHe] murmurs a passage with closed eyes from the Mohammedan holy book.
EVTOPTB_TOG_621	No, this brave Skræling shall live to see another day.	Soon you shall meet your Prophet, friend.
EVTDESC_TOG_622	[FromFrom.GetTitledFirstName] is dragged to the great oak in front of the temple and a noose is placed around [FromFrom.GetHerHis] neck. Soon [FromFrom.GetFirstName]'s body dangles limply in the cold breeze from one of the tree branches.	No, perhaps this is a bad idea...
EVTOPTA_TOG_622	This should please the gods!	Your brother, [From.GetTitledFirstName], is brought up from his dungeon and escorted to the temple. As the noose is placed around his neck, he looks at you with pleading eyes. Don't do this, [Root.GetFirstName]. There has to be some other way...
EVTDESC_TOG_623	Your liege's guards have brought a Christian, [FromFrom.GetTitledFirstName], to the big oak in front of the temple. As the noose is placed around [FromFrom.GetHerHis] neck, [FromFrom.GetSheHe] continues to prattle on about the Holy Spirit and how we shall all suffer in Hell for our sins... but soon [FromFrom.GetSheHe] speaks no more.	I'm afraid not. Do it, men.
EVTDESC_TOG_624	[FromFrom.GetTitledFirstName], a Mohammedan from your liege's dungeons, has been brought to the temple and will now be sacrificed to the gods. As the noose is placed around [FromFrom.GetHerHis] neck, [FromFrom.GetSheHe] quotes a passage from their holy book right up until the rope tightens and [FromFrom.GetHerHis] feet rise off the ground.	No, I can't do this to my own brother...
EVTDESC_TOG_625	Your liege has told [From.GetHerHis] men to fetch [FromFrom.GetTitledFirstName], [From.GetHerHis] own brother, from the dungeons. [From.GetFirstName] betrays no emotion as [FromFrom.GetFirstName] is brought up to the gallows in front of the temple, and soon his limp body can be seen slowly dangling back and forth in the wind.	Your sister, [From.GetTitledFirstName], is dragged up from her dungeon and escorted to the temple. She looks up at you with tears streaming down her face as your guards place the noose around her neck. Please, [Root.GetFirstName], she says with a trembling voice. Don't let them do this.
EVTDESC_TOG_626	It seems your liege has decided to sacrifice [FromFrom.GetTitledFirstName], [From.GetHerHis] own sister, to the gods. She has been brought out from [From.GetFirstName]'s dark dungeons, and while she squints her eyes in the unfamiliar daylight, the guards place a noose around her neck. Moments later her eyes are forever dead and listless.	There can be no turning back now. I'm sorry.
EVTDESC_TOG_627	To your surprise, [FromFrom.GetTitledFirstName] orders [FromFrom.GetHerHis] guards to bring out [FromFrom.GetTitledFirstName] - [FromFrom.GetHerHis] own father. He is brought to the gallows in front of the temple, and soon he joins the others hanging limply from the branches with dead, gaping eyes.	No... not my own sister...
EVTDESC_TOG_628	[FromFrom.GetTitledFirstName], the mother of your liege, appears at the temple flanked by guards, and to your surprise they escort her right up to the gallows. She pleads in vain with [From.GetTitledFirstName], but [From.GetSheHe] will not be moved. Within moments, she dangles next to the other offerings in the trees outside the temple.	The guards drag your father, [From.GetTitledFirstName], from his dungeon and escort him to the temple where they place the noose around his neck. My [Root.GetSonDaughter], he croaks while looking at you. Can't you find it in your heart to forgive me?
EVTDESC_TOG_629	[From.GetTitledFirstName] marches [From.GetTitledHerHis] own son, [FromFrom.GetTitledFirstName], to the gallows outside the temple. He is to be the next sacrifice. All of his pleas fall on deaf ears, and moments later the guards place the noose around his neck and he is made forever silent.	No.
EVTDESC_TOG_630	Those assembled at the blot gasp in surprise when [FromFrom.GetTitledFirstName], daughter of [From.GetTitledFirstName], is dragged up to the gallows for the next sacrifice. She asks her [From.GetFatherMother] for mercy, but none is forthcoming.	I can't do this to my own father...
EVTDESC_TOG_631	[FromFrom.GetTitledFirstName], a member of [From.GetFirstName]'s own extended family, is dragged from the dungeons and brought to the temple. Despite, or perhaps because of, the fact that they are of the same blood, [From.GetFirstName] shows no mercy and the sacrifice takes place as planned.	Distant screaming can be heard as your guards drag your mother, [From.GetTitledFirstName], from her dungeon. They bring her to the temple and as they place the noose around her neck, she looks at you with pleading eyes. W-why would you do this to your own mother?
EVTDESC_TOG_632	[From.GetTitledFirstName] has apparently decided to sacrifice [From.GetHerHis] own spouse, [FromFrom.GetTitledFirstName], to the gods, and [FromFrom.GetSheHe] has been brought in chains to the temple. Despite professing [FromFrom.GetHerHis] continued love, [From.GetFirstName] has decided to go ahead with the sacrifice.	Because I can.
EVTDESC_TOG_633	In honor of this blot, your liege produces a Skræling from deep within [From.GetHerHis] dungeons. [FromFrom.GetTitledFirstName] is brought to the temple for the sacrifice, and everyone agrees that this is a most worthy sacrifice.	I... I wouldn't...
EVTDESC_TOG_634	As you have no prisoners languishing in your dungeons that are suitable for sacrifice at the blot, you are forced to make do with some randomly purchased thralls. They are brought to the big oak outside the temple, and soon their limp and lifeless bodies are hanging from its thick branches.	The guards fetch your son, [From.GetTitledFirstName], from his dungeon and lead him to the temple. There a noose is placed around his neck and the rope is thrown over a sturdy branch of a nearby oak. Before your men pull at the rope, your son looks at you with tearful eyes. Please don't, [Root.GetFatherMother]... please don't.
EVTOPTA_TOG_634	It is better than nothing.	Do it, men.
EVTDESC_TOG_635	As [From.GetTitledFirstName] had no prisoners languishing in [From.GetHerHis] dungeons that were suitable for sacrifice at the blot, your liege was forced to make do with some randomly purchased thralls. They are brought to the big oak outside the temple, and soon their limp and lifeless bodies are hanging from its thick branches.	I can't do this... not to my own boy...
EVTOPTA_TOG_635	Better than nothing, I suppose.	Your daughter, [From.GetTitledFirstName], is pulled from her dungeon and brought to the temple by your guards. As they place the noose around her neck, she looks at you with a desperate yet piercing glare. Is this really what you have been reduced to, [Root.GetFatherMother]? To do this... against your own daughter?
EVTTOOLTIP_TOG_637	Execution is stayed.	You have left me with little choice.
EVTDESC_TOG_637	As you stand trembling with the noose around your neck, [From.GetTitledFirstName] suddenly seems to have had a change of mind. The noose is removed and you are brought back to the dungeon. It looks like you will live to see another day.	No, send her back... not to my girl...
EVTOPTA_TOG_637	I... how... what?	[From.GetTitledFirstName] is brought from your dungeons by the guards and placed at the gallows in front of the temple. As they place the noose around [From.GetHerHis] neck, [From.GetFirstName] cries out to you. Don't do this, [Root.GetFirstName]! We are family and of the same blood!
EVTDESC_TOG_640	With the sacrifice over, the feast at the end of the blot can now begin. The meat of the animals that were sacrificed has already been prepared, and there is plenty of mead to go around.	Yes, and that only proves my devotion to Odin.
EVTOPTA_TOG_640	Let the celebrations begin!	It is true... [From.GetSheHe] is kin.
EVTOPTA_TOG_641	About time!	Your spouse, [From.GetTitledFirstName], is dragged to the gallows in front of the temple and your guards place the noose around [From.GetHerHis] neck. In a last desperate effort to save  [From.GetHerselfHimself], [From.GetFirstName] calls out to you for mercy. I have always loved you, [Root.GetFirstName]... and I always will.
EVTDESC_TOG_642	The feast is over and with it the blot. It will be at least nine years until you hold the next one, but as your vassals return home, most seem to agree that the ceremony was well worth the trip.	Forgive me then, my love, but this is how it must be.
EVTOPTA_TOG_642	Until next time!	No, this is too much... I can't permit it.
EVTDESC_TOG_643	The feast is over and with it the blot. It will be at least nine years until your liege holds the next one, but as you and the other vassals return home, most seem to agree that the ceremony was well worth the trip.	From deep within your dungeons, your guards bring out [From.GetTitledFirstName], your Skræling prisoner. As they drag [From.GetHerHim] to the front of the temple and place the noose around [From.GetHerHis] neck, the Skræling shouts something in [From.GetHerHis] own language and stares at you defiantly.
EVTDESC_TOG_650	The mead and the spirits being served at the feast have gotten the better of you. You tried to be strong this time, and you did your best to stay away, but the pull was just too great...	Let us show you how a proper human sacrifice is done.
EVTOPTA_TOG_650	*hic* Letsch drrink s-schome morr... 	No, this brave Skræling shall live to see another day.
EVTDESC_TOG_651	[From.GetTitledFirstName] has been drinking more and more since the feast began, and [From.GetSheHe] has now reached a point where [From.GetSheHe] he can no longer stand upright. Surrounded by empty tankards and singing at the top of [From.GetHerHis] lungs, you find [From.GetFirstName] lying on the table amidst the food.	[FromFrom.GetTitledFirstName] is dragged to the great oak in front of the temple and a noose is placed around [FromFrom.GetHerHis] neck. Soon [FromFrom.GetFirstName]'s body dangles limply in the cold breeze from one of the tree branches.
EVTOPTA_TOG_651	I think [From.GetSheHe] has had enough.	This should please the gods!
EVTOPTB_TOG_651	*hic* I k-know thisch schong!	Your liege's guards have brought a Christian, [FromFrom.GetTitledFirstName], to the big oak in front of the temple. As the noose is placed around [FromFrom.GetHerHis] neck, [FromFrom.GetSheHe] continues to prattle on about the Holy Spirit and how we shall all suffer in Hell for our sins... but soon [FromFrom.GetSheHe] speaks no more.
EVTDESC_TOG_653	Your mouth waters as servants place tray after tray of food on the table, and when the other guests engage in conversation, the only sounds coming from your corner are grunts and burps as you begin stuffing yourself. A sudden nausea sets in and you hurry towards the exit, but only make it as far as the lap of [From.GetTitledFirstName]...	[FromFrom.GetTitledFirstName], a Mohammedan from your liege's dungeons, has been brought to the temple and will now be sacrificed to the gods. As the noose is placed around [FromFrom.GetHerHis] neck, [FromFrom.GetSheHe] quotes a passage from their holy book right up until the rope tightens and [FromFrom.GetHerHis] feet rise off the ground.
EVTOPTA_TOG_653	UUAARGGHHHH...	Your liege has told [From.GetHerHis] men to fetch [FromFrom.GetTitledFirstName], [From.GetHerHis] own brother, from the dungeons. [From.GetFirstName] betrays no emotion as [FromFrom.GetFirstName] is brought up to the gallows in front of the temple, and soon his limp body can be seen slowly dangling back and forth in the wind.
EVTTOOLTIP_TOG_654	Is vomited on.	It seems your liege has decided to sacrifice [FromFrom.GetTitledFirstName], [From.GetHerHis] own sister, to the gods. She has been brought out from [From.GetFirstName]'s dark dungeons, and while she squints her eyes in the unfamiliar daylight, the guards place a noose around her neck. Moments later her eyes are forever dead and listless.
EVTDESC_TOG_654	Morsels of food and clean-picked bones fly everywhere from the direction of [From.GetTitledFirstName] as [From.GetSheHe] greedily stuffs [From.GetHerselfHimself] with the delicacies served at the table. Suddenly [From.GetHerHis] face turns a strange shade of green, and [From.GetSheHe] rushes towards the exit but only make it as far as your seat before [From.GetSheHe] starts retching [From.GetHerHis] stomach contents into your lap...	To your surprise, [FromFrom.GetTitledFirstName] orders [FromFrom.GetHerHis] guards to bring out [FromFrom.GetTitledFirstName] - [FromFrom.GetHerHis] own father. He is brought to the gallows in front of the temple, and soon he joins the others hanging limply from the branches with dead, gaping eyes.
EVTOPTA_TOG_654	Those were my best trousers!	[FromFrom.GetTitledFirstName], the mother of your liege, appears at the temple flanked by guards, and to your surprise they escort her right up to the gallows. She pleads in vain with [From.GetTitledFirstName], but [From.GetSheHe] will not be moved. Within moments, she dangles next to the other offerings in the trees outside the temple.
EVTDESC_TOG_655	Morsels of food and clean-picked bones fly everywhere from the direction of [From.GetTitledFirstName] as [From.GetSheHe] greedily stuffs [From.GetHerselfHimself] with the delicacies served at the table. Suddenly [From.GetHerHis] face turns a strange shade of green, and [From.GetSheHe] rushes towards the exit but only make it as far as [FromFrom.GetTitledFirstName] before [From.GetSheHe] starts retching [From.GetHerHis] stomach contents into poor [FromFrom.GetFirstName]'s lap...	[From.GetTitledFirstName] marches [From.GetTitledHerHis] own son, [FromFrom.GetTitledFirstName], to the gallows outside the temple. He is to be the next sacrifice. All of his pleas fall on deaf ears, and moments later the guards place the noose around his neck and he is made forever silent.
EVTOPTA_TOG_655	That could have been me...	Those assembled at the blot gasp in surprise when [FromFrom.GetTitledFirstName], daughter of [From.GetTitledFirstName], is dragged up to the gallows for the next sacrifice. She asks her [From.GetFatherMother] for mercy, but none is forthcoming.
EVTDESC_TOG_656	As you enjoy the feast, you are struck by the warmth and kindness of those sitting next to you at the table. In fact, it's getting just a little too warm. You strip off your clothes and jump up on the table. Help, I'm on fire! you scream at the top of your lungs while waving your arms as the other bewildered guests look on.	[FromFrom.GetTitledFirstName], a member of [From.GetFirstName]'s own extended family, is dragged from the dungeons and brought to the temple. Despite, or perhaps because of, the fact that they are of the same blood, [From.GetFirstName] shows no mercy and the sacrifice takes place as planned.
EVTOPTA_TOG_656	Put me out, put me out!	[From.GetTitledFirstName] has apparently decided to sacrifice [From.GetHerHis] own spouse, [FromFrom.GetTitledFirstName], to the gods, and [FromFrom.GetSheHe] has been brought in chains to the temple. Despite professing [FromFrom.GetHerHis] continued love, [From.GetFirstName] has decided to go ahead with the sacrifice.
EVTDESC_TOG_657	You are enjoying the feast when a shrill scream from the other end of the room suddenly draws your attention. Stark naked, [From.GetTitledFirstName] is running around on the table waving [From.GetHerHis] arms while screaming that [From.GetSheHe] is on fire. You groan and bury your face in your hands.	In honor of this blot, your liege produces a Skræling from deep within [From.GetHerHis] dungeons. [FromFrom.GetTitledFirstName] is brought to the temple for the sacrifice, and everyone agrees that this is a most worthy sacrifice.
EVTOPTA_TOG_657	That lunatic...	As you have no prisoners languishing in your dungeons that are suitable for sacrifice at the blot, you are forced to make do with some randomly purchased thralls. They are brought to the big oak outside the temple, and soon their limp and lifeless bodies are hanging from its thick branches.
EVTOPTB_TOG_657	So [From.GetSheHe] is! And... and so am I! AAAHHH!	It is better than nothing.
EVTDESC_TOG_658	One of the serving girls has been eyeing you ever since you arrived at the feast, and now, fortified with mead, your hands grope at her body and she returns the favor. You pull off each other's clothes and give in to passion. Just as you join in her screams of pleasure, it dawns on you that you're doing this in full view of all the other stunned guests...	As [From.GetTitledFirstName] had no prisoners languishing in [From.GetHerHis] dungeons that were suitable for sacrifice at the blot, your liege was forced to make do with some randomly purchased thralls. They are brought to the big oak outside the temple, and soon their limp and lifeless bodies are hanging from its thick branches.
EVTOPTA_TOG_658	Oops...	Better than nothing, I suppose.
EVTOPTB_TOG_658	[Root.Spouse.GetFirstName] will not be happy about this...	Execution is stayed.
EVTDESC_TOG_659	You are conversing with another guest when loud screams of passion interrupt. In one corner of the room, in full view of everyone else, [From.GetTitledFirstName] is engaged in carnal pleasures with one of the serving girls. Both are completely naked, and only when they notice the stunned silence in the room do they seem to remember where they are.	As you stand trembling with the noose around your neck, [From.GetTitledFirstName] suddenly seems to have had a change of mind. The noose is removed and you are brought back to the dungeon. It looks like you will live to see another day.
EVTOPTA_TOG_659	By [This.Religion.GetRandomGodNameCap]...	I... how... what?
EVTOPTB_TOG_659	Haha, you old dog! Nicely done!	With the sacrifice over, the feast at the end of the blot can now begin. The meat of the animals that were sacrificed has already been prepared, and there is plenty of mead to go around.
EVTOPTC_TOG_659	No! [From.GetFirstName], what have you done?!	Let the celebrations begin!
EVTDESC_TOG_661	You have been seated next to [From.GetTitledFirstName] for the duration of the feast, and you have found [From.GetHerHim] to be a most agreeable person. There seems to be much you have in common.	About time!
EVTOPTA_TOG_661	It would seem I have a new friend.	The feast is over and with it the blot. It will be at least nine years until you hold the next one, but as your vassals return home, most seem to agree that the ceremony was well worth the trip.
EVTDESC_TOG_664	Your mind wanders as you sit at your table during the feast, when suddenly you lock eyes with [From.GetTitledFirstName]. Something about [From.GetHerHis] gaze seems to reach into your heart, and when [From.GetSheHe] steps outside for some fresh air, you quickly excuse yourself to join [From.GetHerHim].	Until next time!
EVTOPTA_TOG_664	I thought I was the only one...	The feast is over and with it the blot. It will be at least nine years until your liege holds the next one, but as you and the other vassals return home, most seem to agree that the ceremony was well worth the trip.
EVTTOOLTIP_TOG_669	You are discovered!	The mead and the spirits being served at the feast have gotten the better of you. You tried to be strong this time, and you did your best to stay away, but the pull was just too great...
EVTDESC_TOG_669	You are locked in the embrace of your lover, and just as you kiss each other another guest wanders out of the feast hall and notices you. Though you immediately let go of each other, the damage is already done as the outraged guest rushes back inside to tell everyone what he saw.	*hic* Letsch drrink s-schome morr... 
EVTOPTA_TOG_669	It... it's not what it looks like!	[From.GetTitledFirstName] has been drinking more and more since the feast began, and [From.GetSheHe] has now reached a point where [From.GetSheHe] he can no longer stand upright. Surrounded by empty tankards and singing at the top of [From.GetHerHis] lungs, you find [From.GetFirstName] lying on the table amidst the food.
EVTDESC_TOG_670	With everything spinning from all the mead you drank, you stumble towards the exit to relieve yourself. As you step outside, you are treated to the sight of [From.GetTitledFirstName] and [FromFrom.GetTitledFirstName], embracing each other and kissing passionately. They immediately stop when they notice you.	I think [From.GetSheHe] has had enough.
EVTOPTA_TOG_670	By [This.Religion.GetRandomGodNameCap]! You... you two were...!	*hic* I k-know thisch schong!
EVTOPTB_TOG_670	Oh, don't mind me. Carry on, friends.	Your mouth waters as servants place tray after tray of food on the table, and when the other guests engage in conversation, the only sounds coming from your corner are grunts and burps as you begin stuffing yourself. A sudden nausea sets in and you hurry towards the exit, but only make it as far as the lap of [From.GetTitledFirstName]...
opinion_held_blot	Held Blot	UUAARGGHHHH...
opinion_feast_scandal	Questionable Behavior at Feast	Is vomited on.
opinion_vomit	Vomited in Lap	Morsels of food and clean-picked bones fly everywhere from the direction of [From.GetTitledFirstName] as [From.GetSheHe] greedily stuffs [From.GetHerselfHimself] with the delicacies served at the table. Suddenly [From.GetHerHis] face turns a strange shade of green, and [From.GetSheHe] rushes towards the exit but only make it as far as your seat before [From.GetSheHe] starts retching [From.GetHerHis] stomach contents into your lap...
opinion_drinking_buddy	Drinking Companion	Those were my best trousers!
