#CODE	ENGLISH	ENGLISH
EVTDESC6350	As I was lying in my bed at night I was suddenly woken by the hissing and growling of my favorite cat. The bedchamber was alive with scratching, scurrying noises, coming from the very walls themselves. I sprang from the bed, but the noises suddenly disappeared and a subsquent investigation of the chamber revealed nothing but patched stone walls.	As I was lying in my bed at night I was suddenly woken by the hissing and growling of my favorite cat. The bedchamber was alive with scratching, scurrying noises, coming from the very walls themselves. I sprang from the bed, but the noises suddenly disappeared and a subsquent investigation of the chamber revealed nothing but patched stone walls.
EVTOPTA6350	Could there be rats in the walls?	Could there be rats in the walls?
EVTOPTB6350	Just a dream, nothing more	Just a dream, nothing more
EVTDESC6351	The servant I had sent to fetch water never returned and when I went to investigate I noticed a strange light emanating from the well. I peered inside and saw a color like no color I had ever seen before. It was like smoke, cold and wet but burning my skin where it touched.	The servant I had sent to fetch water never returned and when I went to investigate I noticed a strange light emanating from the well. I peered inside and saw a color like no color I had ever seen before. It was like smoke, cold and wet but burning my skin where it touched.
EVTOPTA6351	That color is not from this earth!	That color is not from this earth!
EVTOPTB6351	The well must have gone bad	The well must have gone bad
EVTDESC6352	I had repeatedly questioned my servant about the locked mausoleum beneath the castle but it wasn't until today that I found the key, hidden inside a rotting chest in the oldest castle tower. Inside the tomb's dusty passageways I found an empty stone coffin which bore the inscription '[Root.GetFirstName] [Root.GetOnlyDynastyName]'.	I had repeatedly questioned my servant about the locked mausoleum beneath the castle but it wasn't until today that I found the key, hidden inside a rotting chest in the oldest castle tower. Inside the tomb's dusty passageways I found an empty stone coffin which bore the inscription '[Root.GetFirstName] [Root.GetOnlyDynastyName]'.
EVTOPTA6352	This coffin looks comfortable to sleep in	This coffin looks comfortable to sleep in
EVTOPTB6352	Well, that was morbid... seal the tomb!	Well, that was morbid... seal the tomb!
EVTDESC6353	An old cottar and his wife who were known for their cruelty to cats were found dead in their home this morning, their bones picked clean of meat. My steward tells me that the local townspeople had their cats go missing the day before, but all the missing cats returned today looking fat and happy...	An old cottar and his wife who were known for their cruelty to cats were found dead in their home this morning, their bones picked clean of meat. My steward tells me that the local townspeople had their cats go missing the day before, but all the missing cats returned today looking fat and happy...
EVTOPTA6353	Pass a law banning the killing of cats	Pass a law banning the killing of cats
EVTOPTB6353	A coincidence, nothing more	A coincidence, nothing more
EVTTOOLTIP6354	Somewhere, a dreamer stirs...	Somewhere, a dreamer stirs...
EVTDESC6354	Since the incident some weeks ago I have felt uneasy. I took a walk along the coast to clear my mind and found a small village where the people claimed to worship the 'Old Ones', Gods older than even those of the [Root.Religion.GetName] faith. They invited me to join in their rituals and showed me a dusty old grimoire written by a mad Saracen.	Since the incident some weeks ago I have felt uneasy. I took a walk along the coast to clear my mind and found a small village where the people claimed to worship the 'Old Ones', Gods older than even those of the [Root.Religion.GetName] faith. They invited me to join in their rituals and showed me a dusty old grimoire written by a mad Saracen.
EVTOPTA6354	I must study this grimoire	I must study this grimoire
EVTTOOLTIP6355	[Root.GetBestName] learns the forbidden secrets	[Root.GetBestName] learns the forbidden secrets
EVTDESC6355	Intense study of the grimoire has gained me much knowledge. I have devised a ritual to awaken the most powerful of the Old Ones where he sleeps, dead but dreaming, in his watery tomb beneath the ocean. The cult has prepared the ritual attire and is gathering the necessary sacrifices.	Intense study of the grimoire has gained me much knowledge. I have devised a ritual to awaken the most powerful of the Old Ones where he sleeps, dead but dreaming, in his watery tomb beneath the ocean. The cult has prepared the ritual attire and is gathering the necessary sacrifices.
EVTOPTA6355	Tonight, he will wake!	Tonight, he will wake!
EVTTOOLTIP6356	[Root.GetBestName] puts on a black robe and wizened old hat	[Root.GetBestName] puts on a black robe and wizened old hat
EVTDESC6356	The cult has gathered for the ritual on the shore of a black and stormy sea. The chanting begins, Ph'nglui mglw'nafh..., and in the depths of the dark waters something stirs...	The cult has gathered for the ritual on the shore of a black and stormy sea. The chanting begins, Ph'nglui mglw'nafh..., and in the depths of the dark waters something stirs...
EVTOPTA6356	He comes! HE COMES!	He comes! HE COMES!
EVTOPTB6356	What have I done?! I must stop this!	What have I done?! I must stop this!
EVTTOOLTIP6357	[Root.GetBestName] commandeers a longboat	[Root.GetBestName] commandeers a longboat
EVTDESC6357	I steered the longboat through the raging waters towards the monstrous creature. It stood as tall as a castle tower, with the body of a man and the head of a great tentacled beast. I knew that I had awoken it from where it slept beneath the waves and that it was here to end the age of man. There was only one thing I could do...	I steered the longboat through the raging waters towards the monstrous creature. It stood as tall as a castle tower, with the body of a man and the head of a great tentacled beast. I knew that I had awoken it from where it slept beneath the waves and that it was here to end the age of man. There was only one thing I could do...
EVTOPTA6357	Ramming speed!	Ramming speed!
EVTTOOLTIP6358	A fateful collision...	A fateful collision...
EVTDESC6358	I awoke in my own bed weak and sweating. The servants told me that they had found me on the shore, naked and half-drowned. I asked them about the creature and the ship but they just looked at me with worried eyes and shook their heads. It seems I am the only living witness to these events.	I awoke in my own bed weak and sweating. The servants told me that they had found me on the shore, naked and half-drowned. I asked them about the creature and the ship but they just looked at me with worried eyes and shook their heads. It seems I am the only living witness to these events.
EVTOPTA6358	I must put them to print	I must put them to print
EVTOPTB6358	Fools! I saved you all!	Fools! I saved you all!
LOWER_RELATIVE_POWER	Army is less than §Y$VAL$%§W of §Y$OTHER$§W.	Army is less than §Y$VAL$%§W of §Y$OTHER$§W.
HIGHER_RELATIVE_POWER	Army is at least §Y$VAL$%§W of §Y$OTHER$§W.	Army is at least §Y$VAL$%§W of §Y$OTHER$§W.
TRIBAL_TITLE_DESTROYED_SETUP	Tribal Title Abandoned	Tribal Title Abandoned
TRIBAL_TITLE_DESTROYED_LOG	The formal title '§Y$TITLE$§!' has been abandoned.	The formal title '§Y$TITLE$§!' has been abandoned.
TRIBAL_TITLE_DESTROYED_LETTER	There is no reason to formally use the title '§Y$TITLE$§!' anymore - it sounds primitive and shall henceforth be abandoned.	There is no reason to formally use the title '§Y$TITLE$§!' anymore - it sounds primitive and shall henceforth be abandoned.
killed_an_old_one	Godslayer	Godslayer
alert_can_reform_religion_name	§YReligion can be Reformed§!	§YReligion can be Reformed§!
alert_can_reform_religion_instant	§YReligion can be Reformed§!	§YReligion can be Reformed§!
alert_can_reform_religion_delayed	The §Y$RELIGION$§! faith can be reformed into an organized religion	The §Y$RELIGION$§! faith can be reformed into an organized religion
HOLYSITE_CONTROL_OURS	The Holy Site of §Y$SITENAME$§! is completely under the control of §Y$RELIGION$§!	The Holy Site of §Y$SITENAME$§! is completely under the control of §Y$RELIGION$§!
HOLYSITE_CONTROL_PARTIAL	The Holy Site of §Y$SITENAME$§! is held by a member of §Y$RELIGION$§!, but is a vassal of another religion	The Holy Site of §Y$SITENAME$§! is held by a member of §Y$RELIGION$§!, but is a vassal of another religion
HOLYSITE_CONTROL_NOT	The Holy Site of §Y$SITENAME$§! is not held by a member of §Y$RELIGION$§!	The Holy Site of §Y$SITENAME$§! is not held by a member of §Y$RELIGION$§!
HOLYSITE_LOCATION	The Holy Site of §Y$SITENAME$§! is located in the county of §Y$COUNTY$§!	The Holy Site of §Y$SITENAME$§! is located in the county of §Y$COUNTY$§!
INTERACTION_REQUIRES_NO_LOOTING_HOSTILITY	We cannot declare war on §Y[Recipient.GetTitledFirstName]§! while we are raiding them	We cannot declare war on §Y$RECIPIENT$§! while we are raiding them
FROM_ATTRIBUTES	From Attributes: §G+$AMOUNT$§!	From Attributes: §G+$AMOUNT$§!
HOLY_SITES_LESS	Does NOT control at least §Y$VAL$§W holy sites\n	Welcome to The Old Gods!
HOLY_SITES_LEAST	Controls at least §Y$VAL$§W holy sites\n	Playing as a Pagan in 'The Old Gods' is quite different from playing as a Christian or Muslim ruler. This Hint screen will explain the fundamentals of pagan gameplay, which is useful to know even for Crusader Kings II veterans.
MAJOR_RIVER_SHORT	Crossing of the Major River §Y$RIVER$§! to §Y$TO$§!	Conquest is much easier for pagan rulers - you can subjugate all other pagans and conquer neigbouring counties at will. The seafaring Norse have the added option of taking any coastal county, and can declare 'Prepared Invasions' in which restless bands of adventurers may join the ranks in hopes of plunder and glory.\nTake care, however, for keeping your realm together is far more difficult for Pagans - vassals are more likely to join independence factions, and can win such wars easier. Pagan vassals are also more sceptical of new rulers, which can cause problems until you prove yourself worthy. Pagan realms are prone to grow quickly and then break apart as generations pass.
MAJOR_RIVER_DESC	When attacking over a Major River, the attacking army will get a significant combat penalty	Pagans are not as centralized as Christian and Muslim rulers and are therefore limited to low Crown Authority and the Gavelkind succession law.\nHowever, a powerful and pious Pagan ruler who controls enough Holy Sites can Reform their religion so that it is better able to compete with the monotheistic faiths.\nThe reformer creates or becomes the new religious head of the reformed religion, and all faithful rulers gain the ability to wage Holy Wars. The restrictions on Crown Authority and Succession Laws are lifted and it becomes easier to manage large realms - independence factions will be less potent and vassals will be more accepting of the new ruler on succession.
RETCAP_FROM_REALM	From Realm: §G$REALM$§!\n   Holdings: §Y$HOLDINGS$§!\n   Cap per Holding: §Y$PERHOLDING$§!\n	As a Pagan male, you are able to take up to 3 Concubines in addition to your wife. However, these women will not add to your stats or provide alliances. You can gain Concubines through diplomacy or by simply taking any imprisoned woman as your Concubine.
RETCAP_FROM_BUILDINGS	From Buildings: §G$AMOUNT$§!\n	The Christians and Muslims are a constant threat to Pagans - they are more stable and can wage Holy Wars on you. However, all Pagans except the Tengri have a great defensive advantage: non-pagans take significant attrition damage in pagan lands. Alas, this effect does not last forever though - if the Pagan religion is reformed or if the attacker has a high enough technological level, the advantage is lost.
RETCAP_FROM_TECH	From Technology: §G+$PERCENT$%§!\n	The Pagan religions can be roughly sorted into two groups: Offensive (Tengri, Norse) and Defensive (Suomenusko, West African, Romuva, Slavic).
RETCAP_MINIMUM_RETINUE	Minimum Retinue: §Y$MIN$§!\n	The Offensive Pagans:\nAll Offensive Pagans lose Prestige when they have not been at war for some time, but they also never have a shortage of CBs to use on all those around them. Alternatively, they can go looting!
RETCAP_FROM_RELIGION	From Religion: $AMOUNT$\n	To loot, select an army and click on the 'Toggle Looter' button. Move the army to the lands of someone not of your religion to have them start looting. This will make you hostile toward the owner of the county and all his lieges, so beware of their troops.\nIf you are looting a county neighbouring your own lands, the loot will go straight into your coffers. Otherwise, you need a fleet in an adjacent sea zone. The loot will be loaded onto the ships, and will then need to be transported back to the homeland, so plan accordingly.\nThis means that only coastal counties and those next to your land can be looted. If you are Norse however, you have another option - your ships can navigate the major rivers of Europe, opening up more areas for raiding.
RETCAP_TOTAL	\nTotal: §Y$TOTAL$§!	The Norse also have the ability to do Prepared Invasions. After declaring their intention to invade an enemy, landless adventurers may flock to their banners. These extra troops will allow smaller Norse realms to take on larger enemies, making them even more dangerous to the Christian and Muslim world. However, both attacker and defender need to be of reasonable size and a ruler can only attempt one prepared invasion in his lifetime.
RAISE_COUNTY_LEVIES	Raise County Levies	The Defensive Pagans:\nThese Pagans are not quite as aggressive as the Norse and the Tengri - instead they focus on the defence of their homelands. The troops of the defensive pagans are more powerful than those of other religions, especially in counties of their own religion. Defensive pagans also have larger garrisons in their homelands.
RAISE_COUNTY_FLEETS	Raise County Fleets	Even though you are not playing as a Pagan you will find that they are bound to influence your game in many ways. This Hint screen will explain how their unique gameplay affects you, which can be useful even if you are a Crusader Kings II veteran.
TECH_DEM_INC_EMPERORS	§G+$AMOUNT$§! Demesne size for Emperors	The first thing to be aware of when dealing with Pagans is that they are much more aggressive than other, more 'civilized' religions. They can conquer or subjugate each other at will and are always a threat to their neighbours due to their looting and their powerful troops. A wise leader will know when to strike at them however, for their realms are far less stable than ours, especially in the early years of a new chieftain.
TECH_DEM_INC_KINGS	§G+$AMOUNT$§! Demesne size for Kings	Any county that borders a Pagan realm or that the Vikings can access via sea or river is at risk of their raids. Vikings will come in their ships, and steppe nomads on horses from the vast Tartar wastes. As they siege our counties, they loot and pillage the countryside, which will temporarily lower the tax income, so it is important to raise an army and chase them out. If they manage to actually occupy holdings, they can pillage these even further, burning down buildings, or even entire holdings. We can prevent this mainly by building forts - the fort level prevents looting, and heavily fortified counties can even block the Vikings' ability to sail down rivers.
TECH_DEM_INC_DUKES	§G+$AMOUNT$§! Demesne size for Dukes	The Pagan realms themselves are not the only threat - Vikings can declare their intention to invade a civilized country. Heathen adventurers from far and wide may then travel to join their ranks, boosting a normally harmless realm into a serious threat for even the mightiest of civilized rulers.
TECH_DEM_INC_COUNTS	§G+$AMOUNT$§! Demesne size for Counts	You can, of course, attempt to civilize these barbarians by sending our religious councillor to convert their rulers. If all else fails, you can also dominate them with Holy Wars, but you should be aware of how powerful the Pagan armies can be, especially when entrenched in their homelands, where their holdings will be hard to besiege and their troops will be much tougher to beat on the battlefield. Worst of all, it is far harder for us to forage in the hostile forests and marshes of the heathen homelands. Luckily, this harsh penalty can be overcome - either if the Pagans reform their religion and society to a point where we could almost consider them civilized, or if our technology reaches a high enough level.
TECH_DEM_INC_BARONS	§G+$AMOUNT$§! Demesne size for Barons	Does NOT control at least §Y$VAL$§W holy sites\n
#MONTHLY_PIETY_TO_LIEGE	Monthly Piety to Liege:\n	Controls at least §Y$VAL$§W holy sites\n
HINT_TECH_VIEW_TEXT_2	All Rulers above the rank of Count accumulate Technology Points in each of the three groups based on their Attributes.\nThese points can then be spent to increase the technological level in their capital.\nTechnology can also spread to neighbouring provinces, between demesne provinces or in Trade Zones.	Crossing of the Major River §Y$RIVER$§! to §Y$TO$§!
UNDER_PLAYER	This Holy Site is under your control	When attacking over a Major River, the attacking army will get a significant combat penalty
RELIGION_UNIT_MODIFIER	Modifier to all Units and Holdings controlled by this religion:	From Realm: §G$REALM$§!\n   Holdings: §Y$HOLDINGS$§!\n   Cap per Holding: §Y$PERHOLDING$§!\n
RELIGION_UNIT_HOME_MODIFIER	Additional Modifier in counties of this religion:	From Buildings: §G$AMOUNT$§!\n
PROVINCE_HAS_HOLYSITE	This County contains §Y$HOLYSITE$§!, a Holy Site of §Y$RELIGION$§!	From Technology: §G+$PERCENT$%§!\n
recently_conquered	Recently Conquered	Minimum Retinue: §Y$MIN$§!\n
new_administration	New Administration	From Religion: $AMOUNT$\n
#obj_become_king_title	Become King of [This.Capital.Kingdom.GetName]	\nTotal: §Y$TOTAL$§!
#obj_become_king_desc	[This.GetTitledFirstName] wants to become King of [This.Capital.Kingdom.GetName]. If pagan, it allows [This.GetObjectPronoun] the unlimited use of the Subjugation Casus Belli within the kingdom.	Raise County Levies
#obj_become_king_tip	Is King of [This.Capital.Kingdom.GetName]	Raise County Fleets
won_crusade	Victorious in Crusade	§G+$AMOUNT$§! Demesne size for Emperors
lost_crusade	Defeated in Crusade	§G+$AMOUNT$§! Demesne size for Kings
won_holy_war	Won Holy Wars	§G+$AMOUNT$§! Demesne size for Dukes
lost_holy_war	Lost Holy Wars	§G+$AMOUNT$§! Demesne size for Counts
paragon_of_virtue	Paragons of Virtue	§G+$AMOUNT$§! Demesne size for Barons
ruler_bowed_to_pope	Papal Demands Accepted	Monthly Piety to Liege:\n
ruler_defied_pope	Papal Demands Refused	All Rulers above the rank of Count accumulate Technology Points in each of the three groups based on their Attributes.\nThese points can then be spent to increase the technological level in their capital.\nTechnology can also spread to neighbouring provinces, between demesne provinces or in Trade Zones.
ruler_bowed_to_patriarch	Patriarchal Demands Accepted	This Holy Site is under your control
ruler_defied_patriarch	Patriarchal Demands Refused	Modifier to all Units and Holdings controlled by this religion:
religious_order_formed	Religious Orders Formed	Additional Modifier in provinces of this religion:
head_of_religion_neglect	Neglectful Head of Religion	This County contains §Y$HOLYSITE$§!, a Holy Site of §Y$RELIGION$§!
convert_to_attacker_religion	Convert to Attacker's Religion	Recently conquered
convert_to_attacker_religion_desc	We are currently under attack for religious reasons. If I accept conversion, I can end this war now and protect my people...	New Administration
#VASSAL_OPINION_CHANGE	All vassals' opinion of §Y$ABOUT$§! changes by $MUCH$	Become King of [This.Capital.Kingdom.GetName]
OPINION_CHANGE	§Y$ACTIVE$'s§! opinion of §Y$PASSIVE$§! changes by $MUCH$	[This.GetTitledFirstName] wants to become King of [This.Capital.Kingdom.GetName]. If pagan, it allows [This.GetObjectPronoun] the unlimited use of the Subjugation Casus Belli within the kingdom.
OPINION_CHANGE_TIMER	for §Y$TIME$§! $TIMEUNIT$.	Is King of [This.Capital.Kingdom.GetName]
HOSTILE_LOOTING	§YHostile§! and raiding §Y$ENEMY$§! for loot.\nThis will last another §Y$DAYS$§! days.	Victorious in Crusade
HOSTILE_LOOTED	§YHostile§! towards §Y$ENEMY$§! due to being raided.\nThis will last another §Y$DAYS$§! days.	Defeated in Crusade
HOSTILE_BOTH_LOOTING	§YHostile§! towards §Y$ENEMY$§! due to mutual raids.\nThis will last another §Y$DAYS$§! days.	Won Holy Wars
TIMEUNIT_YEARS	years	Lost Holy Wars
TIMEUNIT_MONTHS	months	Paragons of Virtue
ca_shipyard_1	Castle Shipyard	Papal Demands Accepted
ca_shipyard_2	Castle Shipyard	Papal Demands Refused
ca_shipyard_3	Castle Shipyard	Patriarchal Demands Accepted
ca_shipyard_4	Castle Shipyard	Patriarchal Demands Refused
ct_shipyard_1	City Shipyard	Religious Orders Formed
ct_shipyard_2	City Shipyard	Neglectful Head of Religion
ct_shipyard_3	City Shipyard	Convert to Attacker's Religion
ct_shipyard_4	City Shipyard	We are currently under attack for religious reasons. If I accept conversion, I can end this war now and protect my people...
tp_shipyard_1	Temple Shipyard	All vassals' opinion of §Y$ABOUT$§! changes by $MUCH$
tp_shipyard_2	Temple Shipyard	§Y$ACTIVE$'s§! opinion of §Y$PASSIVE$§! changes by $MUCH$
tp_shipyard_3	Temple Shipyard	for §Y$TIME$§! $TIMEUNIT$.\n
tp_shipyard_4	Temple Shipyard	§YHostile§! and raiding §Y$ENEMY$§! for loot.\nThis will last another §Y$DAYS$§! days.
shipyard_desc	Skilled shipwrights are hard at work here, building all sorts of seafaring vessels.	§YHostile§! towards §Y$ENEMY$§! due to being raided.\nThis will last another §Y$DAYS$§! days.
TOGGLE_LOOTER	Toggle Looter	§YHostile§! towards §Y$ENEMY$§! due to mutual raids.\nThis will last another §Y$DAYS$§! days.
TOGGLE_LOOTER_DESC	Setting this Unit to be a Looter will allow it to loot the counties and holdings of other rulers.\nThis will cause a temporary state of hostility with them however, allowing them to attack any of your troops	years
REL_AUTHORITY_CHANGE	§Y$RELIGION$§!: $PERC$ Moral Authority for §Y$TIME$§! $TIMEUNIT$.\n	months
IS_HOLY_CITY_FOR_RELIGION	The §Y$RELIGION$§! faith considers §Y$HOLDING$§! a holy site	Castle Shipyard
IS_HOLY_CITY_FOR_RELIGION_2	They have control of the holding	Castle Shipyard
IS_HOLY_ORDER	Is Holy Order	Castle Shipyard
IS_NOT_HOLY_ORDER	Is NOT Holy Order	Castle Shipyard
opinion_looted	Pillaged my Lands	City Shipyard
opinion_heir_guardian_my_culture	Heir Educated with Proper Culture	City Shipyard
opinion_heir_guardian_foreign_culture	Heir Educated with Foreign Culture	City Shipyard
PORTAGE	Portage between §Y$FROM$§! and §Y$TO$§!	City Shipyard
PORTAGE_DESC	A Portage allows ships to move between Major Rivers over a land county	Temple Shipyard
HOLY_SITE_CONTROLLED	(controlled)	Temple Shipyard
HOLY_SITE_PARTIALLY_CONTROLLED	(partial control)	Temple Shipyard
HOLY_SITE_NOT_CONTROLLED	(not controlled)	Temple Shipyard
RELHEAD_CONTROLS	controls a holy site	Skilled shipwrights are hard at work here, building all sorts of seafaring vessels.
HOLY_SITE_OF	Holy Site of	Toggle Looter
RELHEAD_DIPLO	Diplomacy of	Setting this Unit to be a Looter will allow it to loot the provinces and holdings of other religions.\nThis will cause a temporary state of hostility with them however, allowing them to attack any of your troops
RELHEAD_PIETY	[Player.Religion.GetPietyName] of	§Y$RELIGION$§!: $PERC$ Moral Authority for §Y$TIME$§! $TIMEUNIT$.\n
ORGANIZED_RELIGION	Organized Religion	The §Y$RELIGION$§! faith considers §Y$HOLDING$§! a holy site
INTERACTION_REQUIRES_RECIPIENT_CAN_MARRY	§Y[Recipient.GetTitledFirstName]§! must be able to marry and produce heirs	They have control of the holding
INTERACTION_PREP_INV_ALREADY_TARGETTED	§Y[Recipient.GetTitledFirstName]§! is not already targeted by a Prepared Invasion	Is Holy Order
INTERACTION_PREP_INV_ONLY_ONCE	§Y[Actor.GetTitledFirstName]§! can only prepare one invasion in [Actor.GetPossPronoun] lifetime	Is NOT Holy Order
MORAL_AUTHORITY_OF_RELIGION	Moral Authority of the §Y$RELIGION$§! faith: §Y$AUTHORITY$%§!	Pillaged my Lands
EVTNAME670	The [Root.Religion.GetName] Reformation	Heir Educated with Proper Culture
EVTDESC670	The ancient [Root.Religion.GetName] religion is proving unable to withstand the onslaught of the Cross and the Moon. Rather than abandoning the old ways, [Root.GetTitledName] and the most powerful priests have decided to reform the [Root.Religion.GetName] faith. With codified rites, a holy scripture and a strict church hierarchy under a single leader, they hope that the reformed [Root.Religion.GetName] faith is better armed to fight back against the weak and effeminate foreign beliefs!	Heir Educated with Foreign Culture
EVTOPTA670	For [Root.Religion.GetRandomGodName]!	Portage between §Y$FROM$§! and §Y$TO$§!
EVTOPTB670	Embrace the Reformation!	A Portage allows ships to move between Major Rivers over a land province
EVTOPTC670	The old ways are still best	(controlled)
EVTOPTD670	They are still barbarians!	(partial control)
NUM_CULTURE_REALM_PROVS_LESS	Fewer than §Y$NUM$§! §Y$CULTURE$§! Counties in Realm	(not controlled)
NUM_CULTURE_REALM_PROVS_MORE	At least §Y$NUM$§! §Y$CULTURE$§! Counties in Realm	controls a holy site
NUM_TITLE_REALM_PROVS_LESS	Fewer than §Y$NUM$§! Counties within the §Y$TITLE$§! in Realm	Holy Site of
NUM_TITLE_REALM_PROVS_MORE	At least §Y$NUM$§! Counties within the §Y$TITLE$§! in Realm	Diplomacy of
d_norse_pagan_reformed	The Fylkirate	[Player.Religion.GetPietyName] of
d_norse_pagan_reformed_adj	Norse	Organized Religion
